title,channel,views,url,depth,recommended_from,category_id,tags,thumbnail_url
Harry Potter and the Philosopher's Stone | Official Teaser | HBO Max,Harry Potter,10442686 views,https://www.youtube.com/watch?v=RIu4sFKGi6E,0,initial,1,"Harry Potter,Wizarding World,Warner Bros,Hogwarts,Marauders Map,Draco Malfoy,Ron Weasley,Hermione Granger,Harry Potter Lore,Potter,slytherin,ravenclaw,gryffindor,hufflepuff,hbomax,harrypotterhbo",https://i.ytimg.com/vi/RIu4sFKGi6E/maxresdefault.jpg
Harry Potter and the Sorcerer's Stone,YouTube Movies,,https://www.youtube.com/watch?v=7zBBWAlpShY,1,Harry Potter and the Philosopher's Stone | Official Teaser | HBO Max,30,,https://i.ytimg.com/vi/7zBBWAlpShY/maxresdefault.jpg
"Harry Potter And The Sorcerer's Stone | You're A Wizard, Harry | ClipZone: Heroes & Villains",ClipZone: Heroes & Villains,2864256 views,https://www.youtube.com/watch?v=0aKoA97cj_U,1,Harry Potter and the Philosopher's Stone | Official Teaser | HBO Max,24,"heroes,heroes and villains,clipzone,warner,warner bros,warner bros entertainment,back to hogwarts,Harry Potter,Sorcerer's Stone,Philosopher's Stone,harry potter and the sorcerer's stone,Daniel Radcliffe,Emma Watson,Rupert Grint,Letters From Hogwarts,letters from hogwarts scene,owls harry potter,Hagrid,Hagrid First Scene,Watch Harry Potter,Stream Harry Potter,quidditch,Hogwarts letter,Robbie Coltrane,Voldemort,boy who lived",https://i.ytimg.com/vi/0aKoA97cj_U/maxresdefault.jpg
Harry Potter and the Chamber of Secrets,YouTube Movies,,https://www.youtube.com/watch?v=oSNytbsFkRM,2,Harry Potter and the Sorcerer's Stone,30,,https://i.ytimg.com/vi/oSNytbsFkRM/maxresdefault.jpg
Harry Potter and the Deathly Hallows - Part 1,YouTube Movies,,https://www.youtube.com/watch?v=CG6Z84ZgfE0,2,Harry Potter and the Sorcerer's Stone,30,,https://i.ytimg.com/vi/CG6Z84ZgfE0/maxresdefault.jpg
"""Yer a wizard, Harry"" | Harry Potter and the Philosopher's Stone",Harry Potter,23241819 views,https://www.youtube.com/watch?v=nnD8FKXzIGs,2,"Harry Potter And The Sorcerer's Stone | You're A Wizard, Harry | ClipZone: Heroes & Villains",1,"Wizarding World,harry potter,Fantastic Beasts,jk rowling,j.k. rowling,J.K. Rowling's Wizarding World,magic,wizards,witches,muggles,wands,Leavesden studios,Leavesden,cursed child,harry potter studio tour,harry potter world,harry potter and the philosopher's stone,philosopher's stone,hagrid,rubeus hagrid,diagon alley,hedwig,happybirthdayharrypotter,happy birthday harry potter,harry's birthday,hogwarts,hogwarts school of witchcraft and wizardry",https://i.ytimg.com/vi/nnD8FKXzIGs/maxresdefault.jpg
Harry Potter Wins His First Quidditch Match | Philosopher's Stone,Harry Potter,3995458 views,https://www.youtube.com/watch?v=x7exCL8vc_c,2,"Harry Potter And The Sorcerer's Stone | You're A Wizard, Harry | ClipZone: Heroes & Villains",1,"Harry Potter,Wizarding World,Warner Bros,Hogwarts,Marauders Map,Draco Malfoy,Ron Weasley,Hermione Granger,Harry Potter Lore,Potter,slytherin,ravenclaw,gryffindor,hufflepuff,Harry Potter world,Quidditch,Philosopher's Stone,Sorcerer's Stone,Bludgers,Golden Snitch,Harry and Quidditch,Quidditch march,Quidditch moments,Quidditch scenes,First Quidditch match,Harry Potter match,Harry Potter scenes,Harry Potter moments,Quidditch competition,Harry competitions",https://i.ytimg.com/vi/x7exCL8vc_c/maxresdefault.jpg
Harry Potter and the Prisoner of Azkaban,YouTube Movies,,https://www.youtube.com/watch?v=rUfnUuX2IWM,3,Harry Potter and the Chamber of Secrets,30,,https://i.ytimg.com/vi/rUfnUuX2IWM/maxresdefault.jpg
Harry Potter and the Deathly Hallows - Part 2,YouTube Movies,,https://www.youtube.com/watch?v=6SRt2Is9NcY,3,Harry Potter and the Deathly Hallows - Part 1,30,,https://i.ytimg.com/vi/6SRt2Is9NcY/maxresdefault.jpg
Submarine Attack & Magic Ball Ka Raaz!⚽ | Supa Strikas Hindi | soccer kahaniyan | Hindi stories,Moonbug Kids - Hindi Stories and Learning Rhymes,1842052 views,https://www.youtube.com/watch?v=1WOPIkrX42A,3,"""Yer a wizard, Harry"" | Harry Potter and the Philosopher's Stone",24,"bestcartoons,football,football animation,footballcartoons,footballfun,footballgames,footballstories,forkids,fortodders,fotoballindia,funnycartoons,hindicartoons,hindifootball,hindifuncartoons,hindigames,hindisoccer,hindisoccergames,hindistories,indialovessoccer,indiancartoons,kidstories,soccercartoons,soccergames,soccerindia,soccerstories,storiesinhindi,strikas,supa strikas,supaaa,supastrikahindi,supastrikashindi,super fun football animation,toddlercartoons,toddlerstories",https://i.ytimg.com/vi/1WOPIkrX42A/maxresdefault.jpg
Harry vs. Draco | Chamber of Secrets,Harry Potter,3133595 views,https://www.youtube.com/watch?v=hvyHtaU2k2g,3,Harry Potter Wins His First Quidditch Match | Philosopher's Stone,1,"Harry Potter,Wizarding World,Warner Bros,Hogwarts,Marauders Map,Draco Malfoy,Ron Weasley,Hermione Granger,Harry Potter Lore,Potter,slytherin,ravenclaw,gryffindor,hufflepuff,Harry and Draco,Harry and Draco duel,Severus Snape,Gilderoy Lockhart,Chamber of Secrets,parseltongue,Draco scenes,Draco moments,Harry Potter duel,Draco duel,Lockhart and Snape,Harry parseltongue,Harry Potter snake,Expelliarmus,Everte Statum,Rictusempra,Serpensortia,Alarte Ascendare",https://i.ytimg.com/vi/hvyHtaU2k2g/maxresdefault.jpg
Хогвартс принимает турнир Трех Волшебников. Гарри Поттер и Кубок огня.,Видео Фокс,1726177 views,https://www.youtube.com/watch?v=U66CGseH0G0,3,Harry Potter Wins His First Quidditch Match | Philosopher's Stone,1,"harry,potter,goblet,of,fire,2005,гарри,поттер,и,кубок,огня,фильм,смотреть,онлайн,часть,поттер 4,полностью,хорошем,1080,hd,дэниел,рэдклифф,гермиона,грейнджер,эмма,уотсон,рон,уизли,руперт,грин,седрик,диггори,роберт,паттинсон,драко,малфой,том,фелтон,виктор,крам,станислав,яневский,флер,делакур,клеманс,поэзи,хагрид,алан,криман,снегг,грюм,брендан,глисон,волан,де,морт,рэйф,файнс,видеофокс,видео,фокс,отрывок,трейлер,на русском,турнир,трех,волшебников",https://i.ytimg.com/vi/U66CGseH0G0/maxresdefault.jpg
Gangs Of Wasseypur II,YouTube Movies,,https://www.youtube.com/watch?v=GT41HOs7ccg,4,Harry Potter and the Prisoner of Azkaban,30,,https://i.ytimg.com/vi/GT41HOs7ccg/maxresdefault.jpg
Supa Strikas Ki Sabse Badi Haar! ⚽| Supa Strikas Hindi | soccer kahaniyan,Moonbug Kids - Hindi Stories and Learning Rhymes,689199 views,https://www.youtube.com/watch?v=gSm-WsPqpMs,4,Submarine Attack & Magic Ball Ka Raaz!⚽ | Supa Strikas Hindi | soccer kahaniyan | Hindi stories,24,"bestcartoons,footballcartoons,footballfun,footballgames,footballstories,forkids,fortodders,fotoballindia,funnycartoons,hindicartoons,hindifootball,hindifuncartoons,hindigames,hindisoccer,hindisoccergames,hindistories,indialovessoccer,indiancartoons,kidstories,soccercartoons,soccergames,soccerindia,soccerstories,storiesinhindi,strikas,supa strikas,supaaa,supastrikahindi,supastrikashindi,toddlercartoons,toddlerstories",https://i.ytimg.com/vi/gSm-WsPqpMs/maxresdefault.jpg
Aaya Super Skarra! | Supa Strikas Hindi | soccer kahaniyan | Hindi stories and learning rhymes,Moonbug Kids - Hindi Stories and Learning Rhymes,886842 views,https://www.youtube.com/watch?v=zTWvZxqQnT4,4,Submarine Attack & Magic Ball Ka Raaz!⚽ | Supa Strikas Hindi | soccer kahaniyan | Hindi stories,24,"bestcartoons,footballcartoons,footballfun,footballgames,footballstories,forkids,fortodders,fotoballindia,funnycartoons,hindicartoons,hindifootball,hindifuncartoons,hindigames,hindisoccer,hindisoccergames,hindistories,indialovessoccer,indiancartoons,kidstories,soccercartoons,soccergames,soccerindia,soccerstories,storiesinhindi,strikas,supa strikas,supaaa,supastrikahindi,supastrikashindi,toddlercartoons,toddlerstories",https://i.ytimg.com/vi/zTWvZxqQnT4/maxresdefault.jpg
Top 10 Most Searched For Harry Potter Scenes,Harry Potter,1449871 views,https://www.youtube.com/watch?v=S5MAejibg0g,4,Harry vs. Draco | Chamber of Secrets,1,"Harry Potter,Wizarding World,Warner Bros,Hogwarts,Marauders Map,Draco Malfoy,Ron Weasley,Hermione Granger,Potter,slytherin,ravenclaw,gryffindor,hufflepuff,Harry Potter world,Harry Potter scenes,Harry Potter moments,Harry Potter best scenes,Harry Potter films,Privet Drive,Harry Potter train,Hogwarts Express,Harry Potter Christmas,Harry Potter chess,Patronus,Battle of Hogwarts,Ron and Hermione,Albus Dumbledore,Minerva McGonagall,Remus Lupin",https://i.ytimg.com/vi/S5MAejibg0g/maxresdefault.jpg
Peppa Pig 🐽 Caring for Baby Alexander! 🍼 Sweet Moments ✨ Toon Mania - Little Zoo Club,Toon Mania - Little Zoo Club,52708 views,https://www.youtube.com/watch?v=-jP9ql29nfs,4,Harry vs. Draco | Chamber of Secrets,1,"peppa pig,peppa pig Caring for Baby Alexander!,Caring for Baby Alexander!,peppa pig pets compilation,peppa pig english,peppa pig full episodes,toon mania little zoo club,Mission to Outer Space,pig peppa,for kids,Adorable Pet Friends!,animal friends,cute pets,baby animals,toddler activities,learn animals,early learning,kindergarten songs,little zoo club episodes,best compilation,kids entertainment,george,alexander,baby,peppa baby alexander,babies",https://i.ytimg.com/vi/-jP9ql29nfs/maxresdefault.jpg
Kalam Ka Kamaal - Bandbudh Aur Budbak New Episode - Funny Hindi Cartoon For Kids,KidZ,54447196 views,https://www.youtube.com/watch?v=emp3RSDk2a4,4,Хогвартс принимает турнир Трех Волшебников. Гарри Поттер и Кубок огня.,1,"Bandbudh Aur Budbak,Bandbudh,Budbak,hindi cartoon,funny cartoon,Budh aur badri,Badri,Budh,cartoon series,ZeeQ India,hindi cartoon for kids,funny kids cartoon,Animation,animated series,Bandbudh aur Budbak hindi episodes,cartoon show,hindi cartoon bandbudh aur budbak,hindi cartoon video,funny hindi cartoon,comedy kids cartoon,kids,children,Episode 13,Kalam Ka Kamaal,animated video production,original video animation",https://i.ytimg.com/vi/emp3RSDk2a4/maxresdefault.jpg
हिंदी Oggy and the Cockroaches 🍟 PEEL POTATOES 🍟Hindi Cartoons for Kids,Oggy Hindi - हिन्दी,113703671 views,https://www.youtube.com/watch?v=lnMi9hkMkqY,4,Хогвартс принимает турнир Трех Волшебников. Гарри Поттер и Кубок огня.,24,"Hindi Cartoons for Kids,Oggi,Oggi ja Torakat,Oggy,Oggy and the Cockroaches,Oggy and Škodíci,Oggy en de Kakkerlakken,Oggy et les Cafards,Oggy i karaluchy,Oggy och Kackerlackorna,Oggy og Kakerlakkene,Oggy und die Kakerlaken,Ogi,Ogis ir tarakonai,Ogy,bicycle,big,bollywood,cockroaches,contest,criket,cube,full episode,heat,mosquito,mumbai,oggy,sabotage,strange,tour de France,wild,हिंदी",https://i.ytimg.com/vi/lnMi9hkMkqY/maxresdefault.jpg
Dilwale Dulhania Le Jayenge,YouTube Movies,,https://www.youtube.com/watch?v=IbwjDTOvwG8,5,Gangs Of Wasseypur II,30,,https://i.ytimg.com/vi/IbwjDTOvwG8/maxresdefault.jpg
Veer-Zaara,YouTube Movies,,https://www.youtube.com/watch?v=SvQd-Ra8MHo,5,Gangs Of Wasseypur II,30,,https://i.ytimg.com/vi/SvQd-Ra8MHo/maxresdefault.jpg
हिंदी Oggy and the Cockroaches 🔧 KEYS & IDEAS 🔧 Hindi Cartoons for Kids,Oggy Hindi - हिन्दी,129769357 views,https://www.youtube.com/watch?v=MUMCZZl9QCY,5,Supa Strikas Ki Sabse Badi Haar! ⚽| Supa Strikas Hindi | soccer kahaniyan,24,"Hindi Cartoons for Kids,Oggi,Oggi ja Torakat,Oggy,Oggy and the Cockroaches,Oggy and Škodíci,Oggy en de Kakkerlakken,Oggy et les Cafards,Oggy i karaluchy,Oggy och Kackerlackorna,Oggy og Kakerlakkene,Oggy und die Kakerlaken,Ogi,Ogis ir tarakonai,Ogy,aquatic park,clue,cockroaches,fly,full episode,heat,helicopter,inspector,investigation,oggy,pilot,planet,sport,spray,water,हिंदी",https://i.ytimg.com/vi/MUMCZZl9QCY/maxresdefault.jpg
Sizuka Propose Nobita 💓💖 #virlvideo #doreaemon #nobita #shizuka #love,TROLL_GAMING14,5840741 views,https://www.youtube.com/watch?v=Is22C2gBGBU,5,Aaya Super Skarra! | Supa Strikas Hindi | soccer kahaniyan | Hindi stories and learning rhymes,22,,https://i.ytimg.com/vi/Is22C2gBGBU/hqdefault.jpg
TOM VE JERRY #YENİ Çizgi Film | Gökyüzünde Kovalamaca Derlemesi | @CartoonitoTurkiye,Cartoon Network Türkiye,146527984 views,https://www.youtube.com/watch?v=Vy6LKYUjaP4,5,Aaya Super Skarra! | Supa Strikas Hindi | soccer kahaniyan | Hindi stories and learning rhymes,24,"Cartoon,Network,Türkiye,Film,izle,çizgi,oyun,Oyna,Yarışmaya,Katıl,Turkey,Turkiye,Sürekli,Dizi,Grandpa,Nostalji,Eski,Çizgifilmler,Çizgidiziler,Düblaj,Düblajlı,Altyazılı,Orijinal,tam,ekran,Telifli,Telifsiz,Oyuncağı,Oyuncak,Özel,Bölüm,Final,Bölümü,çizgi film izle Türkçe,cizgi film izle,çoçuk çizgi filmleri,çocuk çizgi filmleri,çocuk filmleri izle,çizgi film animasyon",https://i.ytimg.com/vi/Vy6LKYUjaP4/maxresdefault.jpg
Tom & Jerry em Português | Brasil | Um Pouco de Ar Fresco! | WB Kids,WB Kids Brasil,196768473 views,https://www.youtube.com/watch?v=0S0L-iqUM-4,5,Top 10 Most Searched For Harry Potter Scenes,1,"comédia,animação,desenhos clássicos,gato e rato,desenhos infantis,paisagens,animais,vídeos de gatos fofos,animais fofos,ratoeira,fantasmas",https://i.ytimg.com/vi/0S0L-iqUM-4/maxresdefault.jpg
Sarah explain Harry Potter and the Philosopher’s Stone  book! #wbtourlondon J.K Rowling #harrypotter,Albert and Sarah planet,1971 views,https://www.youtube.com/watch?v=qAh30H3_GL4,5,Top 10 Most Searched For Harry Potter Scenes,22,,https://i.ytimg.com/vi/qAh30H3_GL4/maxresdefault.jpg
Peppa Pig 🐽 Peppa Takes Care of Baby Piggy! 🍼 Toon Mania - Little Zoo Club,Toon Mania - Little Zoo Club,183471 views,https://www.youtube.com/watch?v=qvvYqv8Xsx8,5,Peppa Pig 🐽 Caring for Baby Alexander! 🍼 Sweet Moments ✨ Toon Mania - Little Zoo Club,22,"Peppa Pig,Baby Piggy,Peppa Pig English,Baby Piggy's Adventures,Peppa Pig Full Episodes,Little Zoo Club,Peppa Pig Compilation,Funny Baby Piggy,Peppa Pig Cartoons,Peppa Pig 2026,Cartoons for Kids,Baby Piggy Funny Moments,Peppa Pig Best Episodes,Muddy Puddles,Peppa and George,kid show,Preschool Learning,Peppa Pig Songs,Nursery Rhymes,Baby Piggy Stories,Little Zoo Club Peppa,peppa pig,puddle jumping,outdoor play,funny peppa moments,peppa and george",https://i.ytimg.com/vi/qvvYqv8Xsx8/maxresdefault.jpg
"Leo and Tig - Skin of the Sun, The Mysterious Cave | Episode 1-2 | Toons Mania - Little Zoo Club",Toon Mania - Little Zoo Club,7403 views,https://www.youtube.com/watch?v=bgs1ifDUnPo,5,Peppa Pig 🐽 Caring for Baby Alexander! 🍼 Sweet Moments ✨ Toon Mania - Little Zoo Club,22,"leo and tig,leo and tig cartoon,cartoon for kids,short animation,youtube kids,cartoons for kids,best friends,leo and tig english,new cartoons,cartoon,leo and tig english full episodes,educational cartoons,best cartoon,videos for kids,animation,new cartoons for kids,new educational episodes,educational songs,cartoon cartoon,cartoon video,kids cartoons,kids animation,Toons Mania - Little Zoo Club,Toons Mania,Little Zoo Club,animal cartoons,animals",https://i.ytimg.com/vi/bgs1ifDUnPo/maxresdefault.jpg
Baarish Lallantap - Bandbudh Aur Budbak New Episode - Funny Hindi Cartoon For Kids,KidZ,232763661 views,https://www.youtube.com/watch?v=uJXNupHFKwQ,5,Kalam Ka Kamaal - Bandbudh Aur Budbak New Episode - Funny Hindi Cartoon For Kids,1,"Bandbudh Aur Budbak,Bandbudh,Budbak,hindi cartoon,funny cartoon,Budh aur badri,Badri,Budh,cartoon series,ZeeQ India,hindi cartoon for kids,funny kids cartoon,Animation,animated series,Bandbudh aur Budbak hindi episodes,cartoon show,hindi cartoon bandbudh aur budbak,hindi cartoon video,funny hindi cartoon,comedy kids cartoon,kids,children,Episode 47,Baarish Lallantop,animated video production,original video animation",https://i.ytimg.com/vi/uJXNupHFKwQ/maxresdefault.jpg
"Membersihkan mainan mobil mobilan,motor balap,mobil monster,mobil tangki,animal,anomali,pesawat",All car toys,1298572 views,https://www.youtube.com/watch?v=rzxl9M5Ttek,5,Kalam Ka Kamaal - Bandbudh Aur Budbak New Episode - Funny Hindi Cartoon For Kids,22,,https://i.ytimg.com/vi/rzxl9M5Ttek/maxresdefault.jpg
Motu Patlu | Season 1 |  मोटू पतलू | Yamraj | Voot Kids,JioHotstar Kids,51715242 views,https://www.youtube.com/watch?v=zukBYyKT000,5,हिंदी Oggy and the Cockroaches 🍟 PEEL POTATOES 🍟Hindi Cartoons for Kids,24,"motu patlu,motu patlu cartoon,motu patlu ki jodi,मोटू पतलू,motu patalu ki jodi,motu patlu videos,motu patlu for kids,lot pot comics,motu patlu comedy,kids videos,wow kids,hoopla kidz,peekaboo kids,chuchu tv,voot kids,pakdam pakdai,gattu battu,rudra cartoon,shiva cartoon,new episode,motu patlu in hindi,animation cartoon,cartoon for kids,cartoon motu patlu cartoon,hindi motu patlu,jodi motu patlu ki jodi,new motu patlu,motu patlu game",https://i.ytimg.com/vi/zukBYyKT000/maxresdefault.jpg
Hattori के गाँव से आई Hattori की Future Wife 💍 | Full Episode 31,Ninja Hattori,3026803 views,https://www.youtube.com/watch?v=xYSUr3Kj2tU,5,हिंदी Oggy and the Cockroaches 🍟 PEEL POTATOES 🍟Hindi Cartoons for Kids,24,"disneyindia,cartoons for children,cartoons for kids,cartoons for children disney,new cartoons,hindi cartoon,hindi cartoon tv show,disney tv shows,disney tv shows trailers,disney india channel,Ninja Hattori,Kanzo Hattori,Shinzo,Shishimaru,Kemumaki,Kagechiyo,Ninja Adventures,Anime,Friendship,Cartoon,Kids Show,Action Comedy,Classic Anime,Family Fun,Sofia the First,Princess Sofia,Disney Junior,Amber,James,Spidey,Spiderman,Spidey and His Amazing Friends",https://i.ytimg.com/vi/xYSUr3Kj2tU/maxresdefault.jpg
Tribute To Asha Bhosle - The timeless voice | Video Jukebox | Evergreen Hindi Songs,YRF,316587 views,https://www.youtube.com/watch?v=7GHJ6o-3XNw,6,Dilwale Dulhania Le Jayenge,10,"asha bhosle songs,asha bhosle hits,asha bhosle tribute songs,asha bhosle evergreen songs,asha bhosle old songs,asha bhosle best songs,asha bhosle iconic songs,asha bhosle romantic songs,asha bhosle sad songs,asha bhosle back-to-back songs,asha bhosle old movie songs,asha bhosle jukebox,asha bhosle nonstop songs,asha bhosle and rd burman songs,asha bhosle and lata mangeshkar songs,classic hindi songs,70s bollywood songs,le gayi le gayi song,aaina movie songs",https://i.ytimg.com/vi/7GHJ6o-3XNw/maxresdefault.jpg
Dil To Pagal Hai,YouTube Movies,,https://www.youtube.com/watch?v=LsdtwjoEMHo,6,Veer-Zaara,30,,https://i.ytimg.com/vi/LsdtwjoEMHo/maxresdefault.jpg
Mere Yaar Ki Shaadi Hai,YouTube Movies,,https://www.youtube.com/watch?v=RaefYPyccyQ,6,Veer-Zaara,30,,https://i.ytimg.com/vi/RaefYPyccyQ/maxresdefault.jpg
हिंदी Oggy and the Cockroaches 🥓🍗 FOOD ONLY 🥓🍗 Hindi Cartoons for Kids,Oggy Hindi - हिन्दी,71676781 views,https://www.youtube.com/watch?v=QxEW1NzE0mM,6,हिंदी Oggy and the Cockroaches 🔧 KEYS & IDEAS 🔧 Hindi Cartoons for Kids,24,"Animation,Hindi Cartoons for Kids,Oggi,Oggi ja Torakat,Oggy,Oggy and the Cockroaches,Oggy and Škodíci,Oggy en de Kakkerlakken,Oggy et les Cafards,Oggy i karaluchy,Oggy och Kackerlackorna,Oggy og Kakerlakkene,Oggy und die Kakerlaken,Ogi,Ogis ir tarakonai,Ogy,TV series,amazon,art,artist,bollywood,cockroaches,criket,deliver,food,full episode,heat,mumbai,oggy,package,paint,sauna,weight,हिंदी",https://i.ytimg.com/vi/QxEW1NzE0mM/maxresdefault.jpg
Doraemon new episode | Doraemon full episode in hindi | Watch the new Doraemon episode in Hindi|2026,ADENGAPPA GAMING,504093 views,https://www.youtube.com/watch?v=ZTbUyJ7ttL8,6,Sizuka Propose Nobita 💓💖 #virlvideo #doreaemon #nobita #shizuka #love,22,,https://i.ytimg.com/vi/ZTbUyJ7ttL8/maxresdefault.jpg
TOM VE JERRY | Çifte Kovalamaca | #YENİ ŞOV | @cartoonnetworkturkiye,Cartoon Network Türkiye,262205043 views,https://www.youtube.com/watch?v=GMniyQIc1eU,6,TOM VE JERRY #YENİ Çizgi Film | Gökyüzünde Kovalamaca Derlemesi | @CartoonitoTurkiye,24,"Cartoon,Network,Türkiye,Film,izle,çizgi,oyun,Oyna,Yarışmaya,Katıl,Turkey,Turkiye,Sürekli,Dizi,Grandpa,Nostalji,Eski,Çizgifilmler,Çizgidiziler,Düblaj,Düblajlı,Altyazılı,Orijinal,tam,ekran,Telifli,Telifsiz,Oyuncağı,Oyuncak,Özel,Bölüm,Final,Bölümü,çizgi film izle Türkçe,cizgi film izle,çoçuk çizgi filmleri,çocuk çizgi filmleri,çocuk filmleri izle,çizgi film animasyon",https://i.ytimg.com/vi/GMniyQIc1eU/maxresdefault.jpg
Episodios completos de Tom y Jerry en Singapur  | Cartoon Network Asia |  @WBKidsLatino,WB Kids Latino,59244223 views,https://www.youtube.com/watch?v=ptzJhMJ9ROU,6,TOM VE JERRY #YENİ Çizgi Film | Gökyüzünde Kovalamaca Derlemesi | @CartoonitoTurkiye,1,"Niños,caricaturas,animación clásica,caricaturas clásicas,Looney Tunes,video de gato,gato y ratón,animales,comedia",https://i.ytimg.com/vi/ptzJhMJ9ROU/maxresdefault.jpg
Tom & Jerry in italiano | In Vena Di Amare | WB Kids,WB Kids Italiano,54071763 views,https://www.youtube.com/watch?v=WxDC1vRlA4A,6,Tom & Jerry em Português | Brasil | Um Pouco de Ar Fresco! | WB Kids,1,"Bambini,cartone animato,classico dei cartoni animati,Looney Tunes,video di gatti,gatto e topo,animali,commedia,tom & jerry,tom and jerry,scooby doo,TJIT",https://i.ytimg.com/vi/WxDC1vRlA4A/maxresdefault.jpg
Tom & Jerry em Português | Brasil | Desenho Animado Clássico 116 | WB Kids,WB Kids Brasil,6136002 views,https://www.youtube.com/watch?v=anZUaC2KHOc,6,Tom & Jerry em Português | Brasil | Um Pouco de Ar Fresco! | WB Kids,1,"comédia,animação,desenhos clássicos,gato e rato,desenhos infantis,paisagens,animais,vídeos de gatos fofos,animais fofos,ratoeira,fantasmas,TJBR",https://i.ytimg.com/vi/anZUaC2KHOc/maxresdefault.jpg
Two Episodes Beginners Bible 23  - The Beginners Bible✝️👼,The Beginners Bible,23770 views,https://www.youtube.com/watch?v=yuqfXP5yUBo,6,Sarah explain Harry Potter and the Philosopher’s Stone  book! #wbtourlondon J.K Rowling #harrypotter,1,"Bibel,Beginners Bible,Children's Bible,kinder bible tv,childrens bible tv,kids bible tv 2018,kids bible 2018,bible 2018,bible prophecy kids,bible kids,bible children,bible 4 children,religion children,god explained for kids,god of kids,god of kids video,god video,video of god,gods plan 2018,gods plan in 2018,jesus christ loves you,eastern for kids,mose 40 years,moses and the israelis,david vs goliath for kids,kids bible,bible for kids",https://i.ytimg.com/vi/yuqfXP5yUBo/maxresdefault.jpg
My Little Pony 🌈 Ponyville Begins! Meet The Mane 6 | MLP Full Episode | Toon Mania - Little Zoo Club,Toon Mania - Little Zoo Club,1714 views,https://www.youtube.com/watch?v=Ikk7Ygx3zl4,6,• Peppa Pig 🐽 Peppa Takes Care of Baby Piggy...,22,"my little pony,mlp,mlp full episode,full english episode,friendship is magic,friendship is magic part 1,season 1 episode 1,s1e1,ponyville,ponyville begins,mane 6,pinkie pie,applejack,rainbow dash,rarity,fluttershy,twilight sparkle,spike,princess celestia,night mare moon,equestria,magic adventure,kids video,cartoon for kids,toon mania,toon mania little zoo club,mlp full english episode,mlp the mane 6,mlp 1 episode,mlp english,pony cartoon",https://i.ytimg.com/vi/Ikk7Ygx3zl4/maxresdefault.jpg
Super Bears - Star Sky Story - Episode 1 | Bebebears - Bjorn & Bucky | Toons Mania - Little Zoo Club,Toon Mania - Little Zoo Club,3394 views,https://www.youtube.com/watch?v=FwJzgzmBgho,6,"• Leo and Tig - Skin of the Sun, The Mysteri...",22,"bebebears,bebebears cartoon,cartoon for kids,short animation,youtube kids,cartoons for kids,bebebears english,new cartoons,cartoon,Bjorn & Bucky,educational cartoons,Star Sky Story,videos for kids,animation,new cartoons for kids,new educational episodes,educational songs,cartoon cartoon,cartoon video,kids cartoons,kids animation,Toons Mania - Little Zoo Club,Toons Mania,Little Zoo Club,funny animated movies,Super Bears,bebebears episode 1,kids",https://i.ytimg.com/vi/FwJzgzmBgho/maxresdefault.jpg
Peppa Pig Learns How to Make LUNCH 🍕 | Cooking Pizza & Salad | Full Episodes | Cartoon | 20 Minutes,Toys and Colours,49020216 views,https://www.youtube.com/watch?v=b_kKQ2nDeM8,6,"• Leo and Tig - Skin of the Sun, The Mysteri...",1,,https://i.ytimg.com/vi/b_kKQ2nDeM8/maxresdefault.jpg
Oggy và những chú gián tinh nghịch | THE GIANT người khổng lồ  | S04E23 | phim hoạt hình,Oggy và những chú gián tinh nghịch,48846849 views,https://www.youtube.com/watch?v=_KYqjiqy9JI,6,Baarish Lallantap - Bandbudh Aur Budbak New Episode - Funny Hindi Cartoon For Kids,22,"Heo Peppa Tiếng Việt,K+,Kplus,Moonbug Kids Tiếng Việt,Oggy and the cockroaches,Oggy và những chú gián tinh nghịch,Super Toons TV Tiếng Việt,Wolfoo Tiếng Việt,con mèo,phim hoạt hình tiếng việt,video trẻ em",https://i.ytimg.com/vi/_KYqjiqy9JI/maxresdefault.jpg
Doraemon 4K Full Episode In Hindi |Doreamon Cartoon |#doraemon,Rick k grimes,57624 views,https://www.youtube.com/watch?v=uG4Y8WInjtg,6,Baarish Lallantap - Bandbudh Aur Budbak New Episode - Funny Hindi Cartoon For Kids,22,,https://i.ytimg.com/vi/uG4Y8WInjtg/maxresdefault.jpg
"КОТЭ ТВ - Все серии! Большой сборник - Мультики для детей, малышей 3D",Теремок ТВ,150807591 views,https://www.youtube.com/watch?v=OHWTC3yIca0,6,"Cleaning toy cars, racing motorbikes, monster cars, tank cars, animals, anomalies, planes",1,"мультики для детей,для детей,котенок котэ,Пиньята,котэ тв,синий трактор,котэ геймз,Котэ,мультики,анимация,прикольные мультики,мультфильмы,коте тв,грузовик,сортер,поливалка,учимся считать",https://i.ytimg.com/vi/OHWTC3yIca0/maxresdefault.jpg
